Project Name,Goal,Progress (%),Status,Cost,Owner,Risk Description,Risk Impact,Mitigation,Risk ETA,Dependency Description,Dependency Owner,Dependency Planned Start,Dependency Target ETA,Dependency Actual ETA,Dependency Planned Progress,Dependency Actual Progress,Solution
Wealth Management Integration,Wealth Management Expansion,45,At Risk,120000,Sarah Jenkins,KYC provider API latency,Medium,Implement caching & backup provider,2026-07-28,"Regulatory filing audit; API firewall signoff","Compliance Team; SecOps","2026-07-01; 2026-07-10","2026-07-15; 2026-07-22","2026-07-15; 2026-07-25","100; 90","100; 60","Audited & approved; Latency checks ongoing"
Cloud Infrastructure Auto-scaling,Infrastructure Scaling,80,On Track,240000,Devendra Kumar,Cloud budget overrun,Low,Optimize resource limits,2026-08-05,"Terraform module refactor; Support contract authorization","Infra Ops; Finance","2026-07-02; 2026-07-05","2026-07-12; 2026-07-25","2026-07-12; 2026-07-24","100; 100","100; 100",Code merged; Contract active
Fintech Regulatory Compliance,Regulatory Compliance,95,On Track,75000,Priya Sharma,New RBI guidelines,High,Engage external legal counsel,2026-07-22,"RBI guidelines checklist; Response slide deck","Compliance Team; CTO Office","2026-07-01; 2026-07-08","2026-07-10; 2026-07-18","2026-07-08; 2026-07-18","100; 100","100; 100",RBI verified; Deck completed
NextGen App Migration,Major App Migration,15,Delayed,380000,Vikram Malhotra,Legacy database lock issues,High,Staged migration with blue-green deployment,2026-08-12,"PII encryption scheme; Datacenter ExpressRoute setup","SecOps; Infra Ops","2026-07-01; 2026-07-10","2026-07-12; 2026-07-24","2026-07-12; 2026-07-28","100; 95","100; 60",Keys signed off; Telecom fiber latency
Vendor Governance Portal,Operations & Governance,60,On Track,45000,Anjali Mehta,Vendor API doc incomplete,Medium,Engage vendor account manager,2026-08-01,"ADFS SSO mapping; Procurement cost reconciliation","IT Ops; Finance","2026-07-01; 2026-07-05","2026-07-15; 2026-07-20","2026-07-14; 2026-07-20","100; 100","100; 100",SSO mapped; POs cleared
